scheme_name,fund_house,amfi_code,scheme_category,alpha,beta
SBI Small Cap Fund - Direct Plan - Growth,SBI Mutual Fund,125497,Equity Scheme - Small Cap Fund,0.069335,1.336792
quant Mid Cap Fund - Growth Option - Direct Plan,quant Mutual Fund,120841,Equity Scheme - Mid Cap Fund,0.010999,1.378617
HDFC Money Market Fund - Growth Option - Direct Plan,HDFC Mutual Fund,119092,Debt Scheme - Money Market Fund,0.00144,0.007303
Axis ELSS Tax Saver Fund - Direct Plan - Growth Option,Axis Mutual Fund,120503,Equity Scheme - ELSS,-0.003933,1.442164
Nippon India Large Cap Fund - Direct Plan Growth Plan - Growth Option,Nippon India Mutual Fund,118632,Equity Scheme - Large Cap Fund,-0.015435,1.585155
Aditya Birla Sun Life Banking & PSU Debt Fund - DIRECT - IDCW,Aditya Birla Sun Life Mutual Fund,119551,Debt Scheme - Banking and PSU Fund,-0.068268,0.163401
