scheme_name,fund_house,amfi_code,scheme_category,cagr_1yr,cagr_3yr,cagr_5yr
quant Mid Cap Fund - Growth Option - Direct Plan,quant Mutual Fund,120841,Equity Scheme - Mid Cap Fund,0.029901375792239726,0.1752906817088351,0.18012406223694488
Nippon India Large Cap Fund - Direct Plan Growth Plan - Growth Option,Nippon India Mutual Fund,118632,Equity Scheme - Large Cap Fund,0.005035187625892279,0.15387627982661312,0.16270379434701265
SBI Small Cap Fund - Direct Plan - Growth,SBI Mutual Fund,125497,Equity Scheme - Small Cap Fund,0.05440915901478682,0.14342357936173689,0.15498408815389553
Axis ELSS Tax Saver Fund - Direct Plan - Growth Option,Axis Mutual Fund,120503,Equity Scheme - ELSS,-0.00218829671276366,0.11654303683311884,0.08349404012887018
HDFC Money Market Fund - Growth Option - Direct Plan,HDFC Mutual Fund,119092,Debt Scheme - Money Market Fund,0.06268594289684004,0.07367439832042333,0.06562243173598215
Aditya Birla Sun Life Banking & PSU Debt Fund - DIRECT - IDCW,Aditya Birla Sun Life Mutual Fund,119551,Debt Scheme - Banking and PSU Fund,-0.013446645217725983,-0.0195387462410761,-0.0731764066096171
