scheme_name,fund_house,amfi_code,scheme_category,max_drawdown,peak_date,trough_date
SBI Small Cap Fund - Direct Plan - Growth,SBI Mutual Fund,125497,Equity Scheme - Small Cap Fund,-0.402601,2018-01-08,2020-03-24
Nippon India Large Cap Fund - Direct Plan Growth Plan - Growth Option,Nippon India Mutual Fund,118632,Equity Scheme - Large Cap Fund,-0.399608,2019-05-27,2020-03-23
Aditya Birla Sun Life Banking & PSU Debt Fund - DIRECT - IDCW,Aditya Birla Sun Life Mutual Fund,119551,Debt Scheme - Banking and PSU Fund,-0.366517,2021-01-08,2024-12-20
Axis ELSS Tax Saver Fund - Direct Plan - Growth Option,Axis Mutual Fund,120503,Equity Scheme - ELSS,-0.335099,2020-02-12,2020-03-23
quant Mid Cap Fund - Growth Option - Direct Plan,quant Mutual Fund,120841,Equity Scheme - Mid Cap Fund,-0.334299,2020-01-29,2020-03-23
HDFC Money Market Fund - Growth Option - Direct Plan,HDFC Mutual Fund,119092,Debt Scheme - Money Market Fund,-0.013924,2020-03-11,2020-03-24
